{
  "id": "daily_summary",
  "display_name": "Google Ad Manager — Daily Summary",
  "metrics": [
    "impressions",
    "clicks",
    "ad_revenue"
  ],
  "dimensions": [
    "date"
  ],
  "layout": {
    "chart_type": "line",
    "order_by": "date"
  },
  "narrative_prompt": "Say how ad-server delivery and revenue moved. Money stays in the network's own currency and is never added across two. A day with no rows is a gap, never a zero.",
  "date_window": {
    "default_days": 30,
    "min_days": 7,
    "max_days": 90
  }
}
