{
  "id": "campaign_overview",
  "display_name": "Campaign performance",
  "metrics": ["cost", "impressions", "clicks"],
  "dimensions": ["date", "campaign_id"],
  "layout": {
    "chart_type": "bar",
    "order_by": "cost DESC",
    "top_n": 10
  },
  "narrative_prompt": "Analyze Amazon Ads campaign performance: cost vs clicks trend, flag rising spend with stalling clicks. Recent conversion-adjacent figures are provisional (Amazon restates for weeks).",
  "date_window": {
    "default_days": 30
  }
}
